Place ID,User Name,User ID,User Link,User Thumbnail,User Address,User Photos Count,User Reviews Count,Review Text,Review Language,Review Date,Rating,Feedback Useful,Feedback Funny,Feedback Cool
meijer-davison,Jason G.,SkdA31YuuhVmJtesLiZLVA,https://www.yelp.com/user_details?userid=SkdA31YuuhVmJtesLiZLVA,https://s3-media0.fl.yelpcdn.com/photo/kiX-kgpZSB_vF-lmHSq6Fw/60s.jpg,"Fort Gratiot Township, MI",126,437,Big fan of Meijer.  Always worth a four star from me.  But I actually really loved how this one was laid out.   It had a certain aesthetic appeal that even the one back home doesn't have. Might be too high but I really enjoyed dropping byYa like meijer or ya don't.   Take my five stars with a grain of salt if you must but don't be afraid to come here for you needs!,en,9/4/2023,5,2,N/A,1
meijer-davison,Marie B.,MlXwLd4oF1AJU4wPTsesIw,https://www.yelp.com/user_details?userid=MlXwLd4oF1AJU4wPTsesIw,https://s3-media0.fl.yelpcdn.com/photo/ZKCFkB5fFiVIfbhazNYV7w/60s.jpg,"Canton, MI",653,444,"Needed to take care of business at service desk.  The service was spot on and done with a smile, friendly service desk individual. I was in and out in no time.",en,12/3/2023,5,1,N/A,1
meijer-davison,Kay R.,Pp6KP9XG1pcR11XHQaIVPQ,https://www.yelp.com/user_details?userid=Pp6KP9XG1pcR11XHQaIVPQ,https://s3-media0.fl.yelpcdn.com/assets/srv0/yelp_styleguide/514f6997a318/assets/img/default_avatars/user_60_square.png,"Davison, MI",N/A,34,"I have been to Meijer maybe 3 times this yr. Pick up has always been great except for the lazy shopper that says everything is out of stock. Now I can see m MPerks, can not get into my account ""says there are issues "". I can not create a new account??? Have they banned me??? I guess WAL-MART & Kroger will continue getting my money without the buy 6 or ten to get on free lol so sad I thought they would do better with all the bad reviews. I'm all for second chances but where are they?",en,11/10/2023,1,N/A,N/A,N/A
meijer-davison,Brittany S.,dfxIpQJ1-jN4Wiaw9Gny8A,https://www.yelp.com/user_details?userid=dfxIpQJ1-jN4Wiaw9Gny8A,https://s3-media0.fl.yelpcdn.com/photo/lj5LCI60aqIO0BxzdZ2VCA/60s.jpg,"Davison, MI",N/A,5,"amazing, excellent, fantastic, kindhearted staff. specifically mike miller. he is just a wonderful man. he knows that store inside and out and he deserves recognition for it.",en,7/31/2023,5,1,N/A,N/A
meijer-davison,No N.,6sPrP0amWlfHYgCLurAEzA,https://www.yelp.com/user_details?userid=6sPrP0amWlfHYgCLurAEzA,https://s3-media0.fl.yelpcdn.com/assets/srv0/yelp_styleguide/514f6997a318/assets/img/default_avatars/user_60_square.png,"CT, CT",N/A,8,I love this meijers because I live right here. They aren't always clean but there is a lot of foot traffic so understandable. They are under construction right now so it is hard to find anything but food is almost always fresh. Service is okay it's normal.,en,3/3/2023,3,N/A,N/A,N/A
meijer-davison,Jeff J.,QUlSUasirM42o7SjJ9KYhA,https://www.yelp.com/user_details?userid=QUlSUasirM42o7SjJ9KYhA,https://s3-media0.fl.yelpcdn.com/assets/srv0/yelp_styleguide/514f6997a318/assets/img/default_avatars/user_60_square.png,"Paradise, MI",N/A,10,"Went in the store today, more then 10 people walking around not wearing masks and store associates seen them and said nothing. Got in argument with some maskless guy and he wanted to fist fight in store . LOL, dude was like 35-40s and still wants to fight anyone that does not agree. Told me I should watch myself ; anyway, will not be back to this store ever. It's terrible that they cannot enforce the mandates that are in place. At least everyone had there shirts and shoes on.",en,8/22/2020,1,N/A,5,1
meijer-davison,Kay R.,6Chz9Yfuj_3l8AWfgCHUQg,https://www.yelp.com/user_details?userid=6Chz9Yfuj_3l8AWfgCHUQg,https://s3-media0.fl.yelpcdn.com/assets/srv0/yelp_styleguide/514f6997a318/assets/img/default_avatars/user_60_square.png,"Davison, MI",N/A,13,"Shop at Davison Meijer at least once a week. They are not stocked up at all. They are not caring the gluten free and the plant based products. I don't care when I go in they are always stocking , can't get down the isle . Their bottle return machines are the worse around. I use to go in there 3-4 times a week, I dread going once a week now. Half the time you still can't get Tylenol in the pharmacy department. Was a great store . So sad! Masks are a joke.",en,9/17/2020,2,N/A,1,N/A
meijer-davison,Ryan J.,TO_IlmpS3KSKzs9jEqC3LA,https://www.yelp.com/user_details?userid=TO_IlmpS3KSKzs9jEqC3LA,https://s3-media0.fl.yelpcdn.com/photo/8wE4fj963MYF_XgU7v7m4g/60s.jpg,"Davison, MI",76,19,"My favorite Meijer to shop at in Genesee County. I have to admit when it first opened the new store layout took me awhile to get use to, but after a few years or so of shopping there, I know where everything is now. I am a big coupon shopper so you can definately find some deals here (Note: They double coupons up to $.50 - max 2 like coupons per transaction)The employees are generally pleasant, but I have noticed most (of the younger ones) at the cashiers lane are pre-occupied with other conserations while waiting on customers. I'm more of an in-and-out guy when it comes to shopping so it really doesn't bother me unless it's slowing down my transaction/wait time. The level of this service has really seem to decline since it has open which I feel is a fair statement to make as I'm at this store 4-5 times a week, sometimes more. This is not a knock on all the employees at all, most at the store in a whole are very kind and extremely helpful whenever I need to ask a question about anything. Thanks (Davison) Meijer Gang!",en,9/27/2011,4,5,1,1
meijer-davison,Sandy H.,lF4TyvK-l8_yFSIiPeRyAw,https://www.yelp.com/user_details?userid=lF4TyvK-l8_yFSIiPeRyAw,https://s3-media0.fl.yelpcdn.com/photo/xNGCoZMxcyTDnWTIhQ0nSw/60s.jpg,"Grand Blanc, MI",10,39,"I FINALLY got a great cashier! Taylor bagged my groceries the way they should be bagged...she didn't put 15 canned goods in ONE bag and she kept my refrigerated/frozen together. I put my groceries up on the conveyor the way I want them bagged, but they never seem to end up that way...until Taylor! I will look to see if she is working the next time I go grocery shopping!!",en,2/11/2019,5,N/A,N/A,N/A
meijer-davison,Tom A.,0-ZWSQ7JGlbu_HDNbCFlLA,https://www.yelp.com/user_details?userid=0-ZWSQ7JGlbu_HDNbCFlLA,https://s3-media0.fl.yelpcdn.com/photo/koV3SLYrBEfBlCCniRxJjQ/60s.jpg,"Grand Blanc Township, MI",N/A,64,Great location right off of Irish Rd. next to I-69.  It's clean and well laid out.  The staff is usually pretty friendly.  They have a very nice produce section and a great wine selection.I would give this 5 stars but the last 2 times that I have gone to use the bottle return area there were 3 machines full and beeping with no one giving them any attention.,en,6/17/2014,4,3,N/A,N/A
meijer-detroit,Michelle C.,Nime554zaggDqNn3BuanBA,https://www.yelp.com/user_details?userid=Nime554zaggDqNn3BuanBA,https://s3-media0.fl.yelpcdn.com/photo/3mqoeP7u08gmV0isoIa5Ow/60s.jpg,"Dearborn, MI",61,109,"*** Pharmacy - Only *** This review is for the Meijer Pharmacy only. I had a great first experience with the pharmacy at this Meijer. They were fast, efficient and thorough. They offered to call my doctor when there was a small issue. And they didn't give me a hard time about using a GoodRx card like other places sometimes do. They actually recommended it, which was nice. Overall I felt like they cared about me and wanted to get me my meds quickly and at the best price. Also, the drive-thru window is very convenient.",en,9/19/2023,5,N/A,N/A,N/A
meijer-detroit,Kenyetta R.,NqGrYuAMdrIc1vdtWv11JQ,https://www.yelp.com/user_details?userid=NqGrYuAMdrIc1vdtWv11JQ,https://s3-media0.fl.yelpcdn.com/photo/egwSmZ6Uqd_m-fkjGMhdnA/60s.jpg,"Highland Park, MI",N/A,3,Kk mikmik Kiki I I Kiki Kiki  Kim Kiki Kiki Kiki kk I'll mi I I I'm ok I'm  Kiki I'll Kiki Kiki Kiki Kiki KikiI Kiki I'll I ok I'll i m I Nikki,en,9/10/2023,5,N/A,1,N/A
meijer-detroit,Karen H.,nWhmiypOehBCC8WCQTeOVg,https://www.yelp.com/user_details?userid=nWhmiypOehBCC8WCQTeOVg,https://s3-media0.fl.yelpcdn.com/photo/6ciYbLrBwOJy7P8kaMVN1Q/60s.jpg,"Canton, MI",391,335,"I don't love everything about this Meijer, but I have to say, the staff is usually amazing. Today, I was able to make a return easily without a receipt. When I went to check out, after dealing with a cart shortage, my items were all over the place in random bags. An employee named Sup C. wasn't annoyed at all and asked questions to make sure she was using the correct bags and organizing my items in a useful way. I was so appreciative of her. Hard to explain, but my day there just was not going right, and she made it a lot better :) This Meijer is also well-stocked and organized.",en,4/24/2022,4,1,N/A,N/A
meijer-detroit,Rita T.,QcVO9_11ss5BYvd2JuVwFQ,https://www.yelp.com/user_details?userid=QcVO9_11ss5BYvd2JuVwFQ,https://s3-media0.fl.yelpcdn.com/assets/srv0/yelp_styleguide/514f6997a318/assets/img/default_avatars/user_60_square.png,"Mesa, AZ",N/A,4,"51 minutes agoNEWI came from out of town and my daughter and I were so excited for your restaurant. We had a terrible experience. I was so excited to have breakfast and we placed our order and waited for 40 min. They brought her order and then (40 min ... MoreAndrea VeraLocal Guide·34 reviews·41 photosa month agoThis place has something for everyone.Inside you will find a big space with unique decor.The customer service was great, even though it was really busy we always got a ... MorePhoto 1 in review by Andrea Vera Photo 2 in review by Andrea Vera Photo 3 in review by Andrea Vera Photo 4 in review by Andrea Vera +5Cowboy JimLocal Guide·109 reviews·1121 photos3 months agoNot my cup of tea. There was a large menu that had pasta, sandwiches, and burgers that were reasonably priced, and there were some more expensive steaks and other fare. In my opinion, the whole atmosphere was like permanent Valentine's Day ... MorePhoto 1 in review by Cowboy Jim Photo 2 in review by Cowboy Jim Photo 3 in review by Cowboy Jim Photo 4 in review by Cowboy Jim 8Sugar Factory - Detroit (Owner)3 months agoThank you for taking the time to review Sugar Factory! We strive to make Sugar Factory a happy and fun place for everyone. If you would like to discuss your experience further, please email us directly at customerservice@SugarFac…Tajuana7 reviews·6 photosa week agoNEWThe was the best experience ever. Lonnie was a great server/bartender and had excellent service. The hostess started are experience with a wonderful greeting. Then the front of the house manger Joseph was awesome. The food was great. Lonnie took care of us from the start to we finished. We will be back.Photo 1 in review by Tajuana Photo 2 in review by Tajuana OpenTableopentable.com ' sugar-...Sugar Factory - Detroit, MIFood was bad. Definitely not worth it. Made reservations, they seated us right away but took 30mins just to come back and get our order and Took them 1 hour ...3.5(1,053) · $30 and underPeople also askWhat is the Sugar Factory famous for?Who owns Sugar Factory Detroit?Does the Sugar Factory Detroit have parking?Is Sugar Factory still coming to Detroit?FeedbackWeb resultstiktok.comtiktok.com ' discoversugar factory detroit reviewsDiscover videos related to sugar factory detroit reviews on TikTok. ... REAL FOOD REVIEW #sugarfactory #detroit #michigan #detriotfood #nastyrestaurants ...Detroit Free Pressfreep.com ' 2022/09/08Sugar Factory opens in downtown Detroit: Here's what to knowSep 8, 2022 -- The huge goblet drinks are $39 for those with alcohol and $29 for those without. Both the goblets and milkshakes look shareable. The King Kong ...You visited this page on 3/26/23.Groupongroupon.com ' dealsFood & Drink (Prix-fixe Menu - Sugar Factory DetroitFood and Drinks at Sugar Factory Detroit. ... 514 Ratings. Regular price $25. $25. Discount price $14. $14. Pub Food · Coach's Corner Bar and Grill.$40.00Sugar Factorysugarfactory.com ' locationDetroit, Michigan -you can contact our Events Department at detroitparties@sugarfact… or call (947) 219-0700. Take a moment to look over our Party Menu. When you're ready to ...Detroit Newsdetroitnews.com ' diningDetroit's Sugar Factory is opening Monday, but reservations are bookedAug 22, 2022 -- There's a ton of buzz about the colorful and dessert-heavy restaurant Sugar Factory American Brasserie, which is making its Detroit debut ...Roadtrippersmaps.roadtrippers.com ' sug...Sugar Factory - DetroitTop Reviews ; Mitchel M. · February 27, 2023 ; Jordyn M. · March 09, 2023 ; Mandy B. · March 26, 2023.Restaurantjirestaurantji.com ' detroitSugar Factory American Brasserie Detroit, MI 48226 - Menu, 251 Reviews and 7 PhotosRecent Reviews · I went to the Sugar Factory back in November, so I thought Iâ€™d be a great day night for my anniversary but the food was not the same when I ...Page NavigationRita Tescher2 reviews51 minutes agoNEWI came from out of town and my daughter and I were so excited for your restaurant. We had a terrible experience. I was so excited to have breakfast and we placed our order and waited for 40 min. They brought her order and then (40 min later) they told me they didn't do breakfast. The manager came over and no apology just had me place another order. My daughter ate her food alone while I watched her. Our server never apologized or came over to our table at all and we were never offered a discount or an apology. I went to pay intending to not leave a tip and they already added a 20 percent tip. I will never go there again.....",en,4/16/2023,1,N/A,1,N/A
meijer-detroit,Karol C.,Kvz7LooABb5Zt5UL0zizIw,https://www.yelp.com/user_details?userid=Kvz7LooABb5Zt5UL0zizIw,https://s3-media0.fl.yelpcdn.com/photo/PcVAZoRnfze_erMCXh00Zg/60s.jpg,"Detroit, MI",1177,438,"Most things are relative and all about an individual's perspective, right?I read a few reviews after stopping at this Meijer this morning, in doing so I was led to chime in.I have visited this Meijer on several occasions. The store has always been clean and fully stocked.My visit this morning was to shop for holiday cards for my board members.I had looked at several other places, wasting time and gas.Meijer had just the selection I needed.I also picked up a bottle of wine on sale. I noticed that several brands were on sale and the selection was pretty decent for a grocer.The bakery was filled with tasty treats from donuts to cakes to holiday cookies. I grabbed a container of donuts and was on my way.At the cash register area, I found several open isles along with several self-checkout bays. I was assisted by staff twice as I checked out. Both ladies greeted me warmly and assisted me quickly. I was in and out in no time.I will remember to patronize this location more often.",en,12/14/2021,4,5,N/A,N/A
meijer-detroit,Lisa G.,YuBq6Y5CoAezEl4aIPY4qw,https://www.yelp.com/user_details?userid=YuBq6Y5CoAezEl4aIPY4qw,https://s3-media0.fl.yelpcdn.com/photo/S8XgyIpqAhxLffYhkBR2kQ/60s.jpg,"Detroit, MI",883,79,"Since this is the closest meijers to my house I often choose to go here when I need groceries. One of the things I love about this location is the presence of DPD. The location is not in a bad area but its always nice to have Detroit's finest present. There are officers inside the store, patrolling the parking lots and even at the gas station. We have gotten to know a few officers from going here so much. Gotta love DPD! The store is pretty well organized and clean. They re-did the self check out. The way it is set up is much more efficient and keeps the line moving. It is a much better set up compared to before. The staff are friendly and helpful.",en,8/6/2021,4,14,10,12
meijer-detroit,Jill P.,g17h0VPRxIU6T1lHRcGpbQ,https://www.yelp.com/user_details?userid=g17h0VPRxIU6T1lHRcGpbQ,https://s3-media0.fl.yelpcdn.com/photo/QiiHUhOUgG4ulVlx0JRA3g/60s.jpg,"Detroit, MI",9,30,"Hands down the worst Meijer I've ever been to. And I hate that it's the only one reasonably close. On the smaller side compared to some stores I've been to and trying (and failing to cater to two VASTLY different demographics (large low income families vs middle class singles or young couples who buy lots of specialty food items). Their new self checkout is pretty excellent but not having a limit on number of items defeats the entire purpose of why they were created in the first place: for those of us with only a few items. Currently waiting in line, there were 10+ FULL TO the BRIM carts in front of me which inevitably taxes the ONE attendant working (and bless her she is working her ass off! I have one item. These full carts have absolutely no business being in self checkout. Put some limits on it. Probably doesn't need to be the 12 or fewer but come on.",en,11/7/2022,1,3,1,N/A
meijer-detroit,Kat L.,EoOr1KpMOJl9MXIpVXvi_A,https://www.yelp.com/user_details?userid=EoOr1KpMOJl9MXIpVXvi_A,https://s3-media0.fl.yelpcdn.com/photo/-TaABNqWiHM7PtyrXXEw3A/60s.jpg,"Detroit, MI",2,34,The worst!!! Why do you have a dozen check out lane but you too fucking cheap to pay people to work them???? I been in linen for 28 minutes and still in the wine isle.... Just waiting to get to the front,en,10/28/2022,1,1,1,N/A
meijer-detroit,Jennifer B.,DVVOGEdQGtMYkF-IheMLwQ,https://www.yelp.com/user_details?userid=DVVOGEdQGtMYkF-IheMLwQ,https://s3-media0.fl.yelpcdn.com/photo/IpLY9iyWivoLwXnKcEVlTQ/60s.jpg,"Lansing, MI",N/A,8,"This Meijer is lacking in many ways. There's never enough staffed check out lanes. Produces are unpredictably out of stock oftentimes. Carts are basically non existent. There's not enough staffs manning the self checkouts. It is very obvious at how corp is neglecting this location. If this Meijer was located in an affluent white neighborhood, you know this wouldn't fly. Why is it acceptable here?",en,9/16/2022,2,3,N/A,N/A
meijer-detroit,C K.,YPMEn8HXsaIFM27_DUcIMQ,https://www.yelp.com/user_details?userid=YPMEn8HXsaIFM27_DUcIMQ,https://s3-media0.fl.yelpcdn.com/assets/srv0/yelp_styleguide/514f6997a318/assets/img/default_avatars/user_60_square.png,"Detroit, MI",N/A,3,"The worst Meijer this lifetime Michigan resident has ever seen. You should stand by the front doors and hear the customers walking in and out swearing and complaining - your complete day's entertainment. Do you want a cart? No cart for you! I mean, you can walk to the back of the lot and maybe you can get one. Abandoned carts on the fringes and tons of carts in store sitting there full of junk. The staff is the absolute worst. They have no idea what they're doing, have terrible attitudes, and don't care. The store is often very dirty. The restrooms are filthy and soap, tp, etc. out of stock. Speaking of out of stock, many items are consistently out of stock. They have no idea how to run a store here. If you need help with something (self checkout issues, prices, customer service, returns), good luck. Just go to another Meijer. Worthless.",en,9/8/2022,1,2,N/A,N/A
meijer-allen-park,Jessica H.,OztqS95PMv2lCv-6TDyoaw,https://www.yelp.com/user_details?userid=OztqS95PMv2lCv-6TDyoaw,https://s3-media0.fl.yelpcdn.com/photo/FvMHoKwkFi5SWij30HJ_Fg/60s.jpg,"Dearborn, MI",N/A,69,Love the numerous self checkouts. Todays visit I needed help a few times today. Brooke and Margaret each so friendly and so helpful. I even learned a coupon type on my phone. Of course Marie in produce is equally as friendly and helpful. Meijer sure takes pride in hiring employees that love their jobs and provide customer satisfaction. Plus having the freshest produce as any market.,en,8/26/2023,5,1,N/A,1
meijer-allen-park,kendra k.,rz8nFRe4PFcqKrJxmNK5Zw,https://www.yelp.com/user_details?userid=rz8nFRe4PFcqKrJxmNK5Zw,https://s3-media0.fl.yelpcdn.com/photo/E1zj6_ZEJLwG5t1pRIsmWg/60s.jpg,"MI, MI",39,19,This Meijer is always in disarray. I walked in through the home section and there were no carts available. I lugged my items to the fresh section to find a cart but I was shocked to find no carts yet again. While walking through the aisles there were dog toys on the floor in the magazine/books section. Baskets filled with abandoned items (where you go to pick them up located at random locations in the store). I walked by the electronics section and there were about 15-20 carts filled with items just sitting there. I am not sure if the team was putting stuff away because I did not see anyone around the carts. Either way it is not a good look. Fresh side: I've noticed they are getting better at keeping items stocked. I have called corporate 3 times in the past to complain that shelves and produce are empty/bare. Meijer is more expensive so if you can stomach going to the bigger box stores I would say do it and not waste your money here.,en,1/9/2024,1,N/A,N/A,N/A
meijer-allen-park,Nicole E.,reOsjVoPYkAQyVVau2crFg,https://www.yelp.com/user_details?userid=reOsjVoPYkAQyVVau2crFg,https://s3-media0.fl.yelpcdn.com/photo/b6DY0c78LfqoJCG4VH5DQA/60s.jpg,"Royal Oak, MI",66274,4586,"I stopped here next and next door, looking for HDMI cables for my team members to connect their monitors. The electronics is located towards the back on the right side of the building. There are HDMI cables mid range and the cheapest one was $15. I bought 4 of the Belkin brand",en,2/10/2023,3,6,2,5
meijer-allen-park,Sheldon M.,g86AD-YNZt4jBqCJlWpylQ,https://www.yelp.com/user_details?userid=g86AD-YNZt4jBqCJlWpylQ,https://s3-media0.fl.yelpcdn.com/photo/JNKb9LgYVwWGW3-Mm6o31g/60s.jpg,"Detroit, MI",179,52,"I don't know which Meijer near Detroit is worse -- this one or the one on 8-mile/Woodward. EVERY SINGLE TIME I place a curbside order there's an issue! Be it missing goods, mixing orders, random non-approved substitutions, long waits or them flat out cancelling my order it's ALWAYS something. This is a hell of a different experience from Texas' HEB and makes me dread ordering from y'all . Do better!",en,12/27/2023,1,1,N/A,N/A
meijer-allen-park,Emil C.,zFo--zdHXg6KJ1RYd8r1BA,https://www.yelp.com/user_details?userid=zFo--zdHXg6KJ1RYd8r1BA,https://s3-media0.fl.yelpcdn.com/photo/btoDrORnOEowX_F5PqED6w/60s.jpg,"Irvine, CA",11284,2052,"After eating lunch at the Chick-fil-A across the parking lot, I stopped in here to pick up some drinks. Since I only had a couple of items, I opted for self checkout. We don't have Meijers back in CA, but I found this one to be clean, well stocked, and well organized. Also the prices were good.",en,12/1/2022,4,1,1,1
meijer-allen-park,Eric E.,OUgNqGQaF_-ZUnTgDQiJWg,https://www.yelp.com/user_details?userid=OUgNqGQaF_-ZUnTgDQiJWg,https://s3-media0.fl.yelpcdn.com/photo/274YPvNHlLkkDQ-jVVARHQ/60s.jpg,"Downriver, Allen Park, MI",70,109,"This store deserves to be closed. They never have anything in stock and refuse to hire more staff. No longer can you use supply chain issues as an excuse for being a complete dumpster fire. I've never once seen a manager doing anything while customers are forced to wait 20 minutes and bag their own groceries. Apparently there's a new store director according to employees and I can tell you first hand this person needs to be fired immediately, they are clearly not qualified to sweep the floors. Will anything change? Of course not, I can only hope I see the director one day while I'm there so I can let them know how their performance is.",en,6/13/2023,1,N/A,N/A,N/A
meijer-allen-park,Joey B.,wfZAJpwK6JRVTpaWFlAyCA,https://www.yelp.com/user_details?userid=wfZAJpwK6JRVTpaWFlAyCA,https://s3-media0.fl.yelpcdn.com/photo/7ddHrklmvbBYOJBtdjPoLg/60s.jpg,"Dearborn, MI",3,43,Not sure how often the fishing and lure section gets restocked but i've been in and out of there for a month and the whole aisle seems to remain the same. Same lures out of stock. Same lure trays not in stock. Meijer is a great place to buy tackle most the time but this location not so much.,en,7/23/2023,2,N/A,N/A,N/A
meijer-allen-park,Melissa M.,17e8eLvj9671AZIlrwZFlw,https://www.yelp.com/user_details?userid=17e8eLvj9671AZIlrwZFlw,https://s3-media0.fl.yelpcdn.com/photo/PyCZ_fBDi71FbcPAOaHmVw/60s.jpg,"Hazel Park, MI",65,543,"Been on hold with them for 15 minutes. Not sure what the issue is with this store. They claim they're out of multiple items that I NEED for what I'm making tonight, and the app says there are ""no substitutions available"". At all?? If I have to go back to the store to get items they ""are out of"" what's the point?",en,6/15/2022,1,1,N/A,N/A
meijer-allen-park,S H.,d_F8VbEm2dJOFCGXiLHnYA,https://www.yelp.com/user_details?userid=d_F8VbEm2dJOFCGXiLHnYA,https://s3-media0.fl.yelpcdn.com/assets/srv0/yelp_styleguide/514f6997a318/assets/img/default_avatars/user_60_square.png,"Southfield, MI",N/A,7,"7:30pm on a Wednesday evening and there's only one register open. The line is into the women's clothing department, ridiculous to say the least. Apparently miejer thinks everyone should ring their own groceries up, so they don't have to pay for a cashier.",en,4/26/2023,1,N/A,N/A,N/A
meijer-allen-park,Kevin Y.,hcE-nUoiadwKnYtxiRQDQA,https://www.yelp.com/user_details?userid=hcE-nUoiadwKnYtxiRQDQA,https://s3-media0.fl.yelpcdn.com/assets/srv0/yelp_styleguide/514f6997a318/assets/img/default_avatars/user_60_square.png,"Downtown Detroit, Detroit, MI",N/A,1,No fitting rooms. Seems like a pretty shady business practice. We should be able to at least know if something fits before we buy.,en,4/22/2023,1,N/A,N/A,N/A
