Place ID,User Name,User ID,User Link,User Thumbnail,User Address,User Photos Count,User Reviews Count,Review Text,Review Language,Review Date,Rating,Feedback Useful,Feedback Funny,Feedback Cool
meijer-adrian,Jim I.,FbUIGS0Q1Eqm-sCS95BXvg,https://www.yelp.com/user_details?userid=FbUIGS0Q1Eqm-sCS95BXvg,https://s3-media0.fl.yelpcdn.com/photo/bKkBqhNNMuN7TnKNwwXmSw/60s.jpg,"MI, MI",4211,312,"I like the remodel except for a couple of things.... Number 1 ...some of the aisles have been moved closer together to where as two carts cannot fit side by side allowing inconsiderate people to block an entire aisle and you know the world is full of inconsiderate people. Number 2.... increased number of self checkouts decreased number of human checkouts. I am not using a self-checkout and putting a human out of a job. But for those of you that have no problem with that,  I hope they come for your job next. But at the end of the day even if this store sucked I would use it over that trashy Walmart any day.",en,7/22/2021,4,N/A,1,1
meijer-adrian,Michael C.,Qm9fQHHWGiCL_LdI-nvShA,https://www.yelp.com/user_details?userid=Qm9fQHHWGiCL_LdI-nvShA,https://s3-media0.fl.yelpcdn.com/photo/vh29d4eufpnZm3xk6xnbrA/60s.jpg,"Tecumseh, MI",N/A,20,It's amazing they Cashiers ask a 65 year old for ID to buy alcohol. Should I insist the cashier show me their ID so I know they are old enough to sell alcohol ? BTW this is the only Meijer I have been to that does this. Funny they seem to be able to enforce ID checks for alcohol but not wearing masks in their store. Fred Meijer can stick my ID up where the sun doesn't shine.,en,4/2/2021,1,N/A,1,N/A
meijer-adrian,Sabrina L.,C0rgUScRvoWq46y21RS4Dw,https://www.yelp.com/user_details?userid=C0rgUScRvoWq46y21RS4Dw,https://s3-media0.fl.yelpcdn.com/photo/lcsP0VFOF9ws0WpUL_ET5A/60s.jpg,"Adrian, MI",16,17,"Not a friendly place to shop. Cashiers are rude, management is rude, no greetings when you walk in the store. Had an entire row or items under a tag that said $10/$10 and wouldn't give it to us for that price. If your stockers can't stick right that's not my problem.Learn to serve your customers better.",en,10/8/2018,2,N/A,1,N/A
meijer-adrian,Mr. P.,hoBXFhaQ48qcQVasAraRvg,https://www.yelp.com/user_details?userid=hoBXFhaQ48qcQVasAraRvg,https://s3-media0.fl.yelpcdn.com/photo/UCgnxdZoaIWYoFfz_T9ISA/60s.jpg,"Sterling Heights, MI",74,62,"Not bad at all when it comes to Meijers. This where I did my shopping when I went to Siena Heights University. It's a clean, organized place and you really don't have to wait very long in line usually.",en,7/16/2014,4,2,N/A,N/A
meijer-adrian,Angela D.,DrJNE2ZHNzTU_Txk2gc9xw,https://www.yelp.com/user_details?userid=DrJNE2ZHNzTU_Txk2gc9xw,https://s3-media0.fl.yelpcdn.com/photo/eGkH4NH4uXUj6qf8kZLGeA/60s.jpg,"Adrian, MI",13,118,As one of only two grocery stores in Adrian I choose Meijer because of the produce and the fact that they pay their employees a decent wage.,en,4/29/2013,4,3,4,1
meijer-adrian,Bruce S.,tGtnagbrkIKXfV7gDNRfOw,https://www.yelp.com/user_details?userid=tGtnagbrkIKXfV7gDNRfOw,https://s3-media0.fl.yelpcdn.com/assets/srv0/yelp_styleguide/514f6997a318/assets/img/default_avatars/user_60_square.png,"Adrian, MI",N/A,8,I've been back to Meijer several times. The balloons are all gone. It's a great place to shop.,en,12/30/2016,5,N/A,N/A,1
meijer-alpena,Mic B.,rKIOFkkY1hAQhCNYimqg1A,https://www.yelp.com/user_details?userid=rKIOFkkY1hAQhCNYimqg1A,https://s3-media0.fl.yelpcdn.com/photo/9C45-exy5ZCxv2Y4dZW-mA/60s.jpg,"Au Sable, MI",23,41,"Love this company. Moved back up north from Florida and miss the Publix stores; Meijer eases the pain. We can get many of our vegan choices that our local Oscoda and Tawas stores just do not carry,nor do they care to. It is worth the drive to shop in a neat, clean well run operation Thank you Meijer",en,1/20/2022,5,N/A,N/A,N/A
meijer-alpena,Mina S.,cff0cU7TniLvipWsYZt8fA,https://www.yelp.com/user_details?userid=cff0cU7TniLvipWsYZt8fA,https://s3-media0.fl.yelpcdn.com/photo/1mZncduUbadnJZwVqxMe1A/60s.jpg,"Saginaw, MI",610,1147,"This is such a nice Meijer! It is very clean well-organized. What really caught my attention was the bakery area. They have a lot of products that I haven't seen at other locations. Normally when there is a function that requires cake, I would be let down after hearing that it was from the supermarket. But after seeing some of what was offered here, I wouldn't be offended at all if it was from this store. They also have nice-looking donuts and buns.",en,3/10/2018,5,2,N/A,N/A
meijer-alpena,Michael S.,TdRoegolE5NV5hYJrILShQ,https://www.yelp.com/user_details?userid=TdRoegolE5NV5hYJrILShQ,https://s3-media0.fl.yelpcdn.com/photo/5Ra5uz9SsOYibdWHYa6Ohw/60s.jpg,"Saginaw, MI",4,99,"Brand new location, naturally everything is fresh and clean. Noticeably greater selection of merchandise compared to most Meijer stores downstate, which is a plus when you have a Walmart Supercenter across the street.The customer service ranged from surprisingly excellent, with associates in the area taking the time to stop and ask if you were finding everything okay, to less-than-stellar with scattered attention when checkout lines back up.Overall, a great addition to Alpena's growing shopping experience.",en,5/10/2015,5,3,1,1
meijer-alpena,Arnie S.,wxSHxdFbwLXqPUq9Rr-O4w,https://www.yelp.com/user_details?userid=wxSHxdFbwLXqPUq9Rr-O4w,https://s3-media0.fl.yelpcdn.com/photo/8sQpmtGBrD8fWZL60MToEA/60s.jpg,"Alpena, MI",N/A,2,"This review is for Meijer Optical. Employee, Carrie, was unbelievably professional, friendly and helpful. Had issues with a defective frame and she went above and beyond to get me a new frame. While waiting for the new frame to come in, I was going to use an older pair of glasses as a backup, but could not find them. She agreed to give me back the defective pair to get me by until the new ones came in. She could not have been more patient and honest. If I were opening a new business, any business, I would hire this woman. This kind of work ethic and treatment of customers is becoming more rare every day.",en,3/21/2018,5,N/A,N/A,N/A
meijer-alpena,Pete P.,PxCTlTfaABn78JEuGT7S8g,https://www.yelp.com/user_details?userid=PxCTlTfaABn78JEuGT7S8g,https://s3-media0.fl.yelpcdn.com/photo/HqdH3qShSDULCPOINbI2TQ/60s.jpg,"Detroit, MI",22,355,This has got to be THE friendliest Meijer I have ever been in!!!! No less than 8 employees greeted me and asked me how I was and wanted to help me find anything I might be looking for. This is a newer Meijer and it really shows. The place is spotless and well lit. The aisles are wide and everything is very accessible. The meat and produce areas were well stocked and everything was very fresh. It's a nice choice to go to besides the Wal Mart across the street. I hope the good people of Alpena embrace this store and it is here for the long haul because I had a great shopping experience here!!!!,en,8/26/2015,5,3,N/A,N/A
meijer-alpena,Emily G.,TkH7MZLEtqqJ-bQMtHOuZQ,https://www.yelp.com/user_details?userid=TkH7MZLEtqqJ-bQMtHOuZQ,https://s3-media0.fl.yelpcdn.com/photo/DUzyDJ8igAcWoP0ngqH2Ug/60s.jpg,"Port Angeles, WA",10,17,"This is a great store, super clean and bright and fun to shop in. Employees are nice and helpful, and my kids love the samples they have sometimes and stopping to say hi to the live lobsters. They have a yarn and craft section, awesome makeup selection including some fancier brands like the balm and bare minerals, and lots of vitamins and supplements.",en,4/19/2016,5,1,N/A,1
meijer-alpena,Sara S.,LwMXGLXYenpw8n-GnRC1DQ,https://www.yelp.com/user_details?userid=LwMXGLXYenpw8n-GnRC1DQ,https://s3-media0.fl.yelpcdn.com/photo/9kkXNbqHEAV8onOBOhH24A/60s.jpg,"Alpena, MI",5,21,Employees are very friendly. I only hate shopping here because the customers I interact with are always rude and crazy on busy days.,en,12/22/2015,4,N/A,N/A,N/A
meijer-alpena,M H.,LGlk-Zb69sGQwJVu2w4U_Q,https://www.yelp.com/user_details?userid=LGlk-Zb69sGQwJVu2w4U_Q,https://s3-media0.fl.yelpcdn.com/assets/srv0/yelp_styleguide/514f6997a318/assets/img/default_avatars/user_60_square.png,"Tampa Bay, FL",253,501,"Sooooo happy Meijer is in Alpena as I hate giving $ to Walmart and Walmart used to be the only mega store option in town. This location is great - huge, clean, great produce area, and the low prices you associate with Meijer. Every employee was super friendly and nice.",en,8/24/2016,5,2,N/A,2
meijer-alpena,Katie Y.,qgKScw2dYvvwJkvljXgFGA,https://www.yelp.com/user_details?userid=qgKScw2dYvvwJkvljXgFGA,https://s3-media0.fl.yelpcdn.com/assets/srv0/yelp_styleguide/514f6997a318/assets/img/default_avatars/user_60_square.png,"Alpena, MI",N/A,2,"Meijer is the place I go to get everything! They are constantly having sales on produce, other foods, beauty products, and clothes. Their produce is always fresh and they sell it for a good price as well. They have more of a variety of makeup lines than Walmart does. I will occasionally even find cute clothing items there. The staff is friendly and always helpful and the store is the cleanest I've ever seen.",en,7/22/2017,5,N/A,N/A,N/A
meijer-auburn-hills,Ted J.,w8q1hum7FsGb6hb9T_2j2g,https://www.yelp.com/user_details?userid=w8q1hum7FsGb6hb9T_2j2g,https://s3-media0.fl.yelpcdn.com/photo/75824VkmJ_RqPUgg3xmEFA/60s.jpg,"Brookfield, WI",680,1398,"I had a major issue here that they were able to resolve to my satisfaction.The manager emailed and called and followed up to assure I was satisfied.If you have trouble at this location, give them a chance to fix it. They do care about their customers.",en,12/6/2023,5,N/A,N/A,N/A
meijer-auburn-hills,James M.,skM8EuDwOQCG8hh4UOLr5A,https://www.yelp.com/user_details?userid=skM8EuDwOQCG8hh4UOLr5A,https://s3-media0.fl.yelpcdn.com/photo/_PYtlYvL012nQatzzvxu4A/60s.jpg,"MI, MI",17,53,"This is a great Meijer -- well stocked, clean and tidy. Prices are affordable across the board. Outstanding selection of frozen pizzas and tasty chicken from Deli up front. Was unaware of the  $ 2.50  Chicken breakfast sandwiches.  Very tasty , recommend",en,1/27/2022,5,N/A,N/A,N/A
meijer-auburn-hills,Becki B.,p2WzI1eXcleCPUbbwJIBUg,https://www.yelp.com/user_details?userid=p2WzI1eXcleCPUbbwJIBUg,https://s3-media0.fl.yelpcdn.com/photo/usZJ2WNEh-pzcQCXdMDaQQ/60s.jpg,"Lake Orion, MI",162,517,"While an email to corporate got no results, I love that our local Meijer store is so fabulously customer focused!I tried the Meijer pick-up for the first time, and realized when I got home that my receipt showed a toilet paper substitution (my bad - I meant to mark no substitutions on the order but missed that). The punchline - I was charged and received NO toilet paper! I emailed customer service, and texted back to the pick-up number. Customer service never replied.The local store called when they got my text and took all the details. The woman on the phone promised to escalate it to a customer service manager at the store, and I heard back again shortly. Jennifer said to wait and see if customer service email fixed it, but just in case she took my address and promised to follow-up and send me a gift card to compensate for the toilet paper (she couldn't adjust the amount already charged).Long story short - Jennifer rocks and I used my gift card today to get the rest of my Thanksgiving needs. So thankful for my wonderful local Meijer store employees :)",en,11/25/2020,5,1,N/A,2
meijer-auburn-hills,Julie H.,LSmb5qCq0RC8lM09TKUqZQ,https://www.yelp.com/user_details?userid=LSmb5qCq0RC8lM09TKUqZQ,https://s3-media0.fl.yelpcdn.com/photo/tglYnSMRnz6goI0CrNrtsQ/60s.jpg,"Johns Island, Charleston, SC",394,156,"I live in South Carolina and we don't have Meijer there. When I visit my family in Michigan, I love to shop at Meijer. So many wonderful things under one roof. I am impressed with the freshness of the fruit and vegetables. The store is clean and well stocked. Sometimes you run into lines for the cash registers, but they move fast. On 10/13/21 at 19:16:12, James provided my checkout, and he was so kind and courteous! A truly wonderful shopping experience.",en,10/15/2021,5,1,N/A,1
meijer-auburn-hills,Jessica R.,ZJTy-5FF_Kz_SUUl2DRvmA,https://www.yelp.com/user_details?userid=ZJTy-5FF_Kz_SUUl2DRvmA,https://s3-media0.fl.yelpcdn.com/assets/srv0/yelp_styleguide/514f6997a318/assets/img/default_avatars/user_60_square.png,"Auburn Hills, MI",3,2,"This meijer absolutely INFURIATES me. Every single time I come here, the fish in the tanks and containers look absolutely terrible. The beta fish barely have an inch of water in their containers. Betas don't need a lot of room, but it is terrible how poorly they treat them. Yes, they're just fish, but cmon people... it's really not that hard. You can rarely find an employee to get some help, and they're typically always out of things that I need. I hate this meijer.",en,5/20/2022,1,2,N/A,N/A
meijer-auburn-hills,Marcella G.,HWKqQBRWfGtat-0FL9H4VA,https://www.yelp.com/user_details?userid=HWKqQBRWfGtat-0FL9H4VA,https://s3-media0.fl.yelpcdn.com/assets/srv0/yelp_styleguide/514f6997a318/assets/img/default_avatars/user_60_square.png,"Key Biscayne, FL",N/A,3,Meijer.com is a joke .. will not be using their services any longer .. ! I ordered for my mom who is disabled and can't shop herself so I ordered for her . I just had surgery so can't take her .. well after they charged not only her credit card but her ebt and didn't fulfill the order .. now after speaking with the complaints department there is nothing they can do .. so now she had to wait 3-5 days until she gets her money back.. what a mess.. how do they know if that's all the money she had ?! Offered nothing in return.. boygotting meijer all together.. plenty of other places to shop !!,en,11/17/2022,1,N/A,N/A,N/A
meijer-auburn-hills,Brittney W.,Zd6tjEpcX4OQ7jJfJGUPNA,https://www.yelp.com/user_details?userid=Zd6tjEpcX4OQ7jJfJGUPNA,https://s3-media0.fl.yelpcdn.com/assets/srv0/yelp_styleguide/514f6997a318/assets/img/default_avatars/user_60_square.png,"North Street, MI",9,16,Always out of literally everything I need so I'm forced to drive to Kroger after here very often to get missed items. Employees are usually pretty nice but they stare a lot.,en,3/10/2022,1,N/A,N/A,N/A
meijer-auburn-hills,Ashley C.,cAEZkEdZg3HTyJvqyFcsiQ,https://www.yelp.com/user_details?userid=cAEZkEdZg3HTyJvqyFcsiQ,https://s3-media0.fl.yelpcdn.com/photo/KLgKbYbNfJYCf7BPoWj3jw/60s.jpg,"Charter Township of Clinton, MI",2,10,"I'm going to go straight to the balloon department. I have never, experienced such slow service. After 30 minutes of watching someone blow up 11...yes eleven balloons I decided to download the Yelp app, and do this review while I'm continuing to wait for the remaining seven. It took 2 pages over the intercom and twenty minutes of waiting for someone to come over and now 30 minutes of blowing up these balloons. It will take over  an HOUR to blow up 18 balloons!!! I would have left, but I have a cart full and with the baby I just can't do it. This is ridiculous.",en,11/21/2020,1,N/A,N/A,N/A
meijer-auburn-hills,Ben F.,3G5PLZ9fWOGf4yqYOT-vuQ,https://www.yelp.com/user_details?userid=3G5PLZ9fWOGf4yqYOT-vuQ,https://s3-media0.fl.yelpcdn.com/photo/oHZ2PZzvWJRUwqoifN1Vdw/60s.jpg,"Pleasanton, CA",N/A,10,Employees told me I could return a gift card when I bought it because I wasn't sure my niece would like it. She said she wanted a different one so I went to return it and they said they don't return gift cards. So the employees obviously have no knowledge of their store policies. Never shopping here again would rather go to Target right across the street.,en,6/2/2021,1,N/A,N/A,N/A
meijer-auburn-hills,Albert K.,4VfR87_EkCKBCIh9UDOC4w,https://www.yelp.com/user_details?userid=4VfR87_EkCKBCIh9UDOC4w,https://s3-media0.fl.yelpcdn.com/photo/DK539UsbtlUoUiAhHyfB4A/60s.jpg,"Troy, MI",472,511,"I have always been a fan of Meijer, but this one is much nicer than the typical store. Along with the standard amenities, I appreciate the little touches like have seating in the book area, and overall they just do a great job keeping this location clean.  Also, they have a solid craft beer sections.",en,4/3/2019,4,1,N/A,N/A
meijer-rochester-hills-2,Lori C.,pbZLMYlxY42IHMPLBvHcBQ,https://www.yelp.com/user_details?userid=pbZLMYlxY42IHMPLBvHcBQ,https://s3-media0.fl.yelpcdn.com/photo/awnAyzgduQDJ271a9IyEmA/60s.jpg,"Oakland charter Township, MI",12,37,"I love this Meijer's.  Probably because the people that work there are so amazing.  From the dairy/freezer food section, beauty/health, dry foods, produce, through to check out and customer service.  Everyone is willing to help and friendly.  Seeing the same people is comforting. I have been going to this location since they opened.  I tend to compare them to other locations and other trendy stores.  I always think this store is the one for me.  They recently did a bit of reworking the shelves and new products.  The employees work really hard.  They always look like they take pride in what they do.   Very nice to see.",en,10/8/2019,5,N/A,1,N/A
meijer-rochester-hills-2,Lauren P.,Sc9wmkjiAfj8jAXYMihjTg,https://www.yelp.com/user_details?userid=Sc9wmkjiAfj8jAXYMihjTg,https://s3-media0.fl.yelpcdn.com/assets/srv0/yelp_styleguide/514f6997a318/assets/img/default_avatars/user_60_square.png,"Pontiac, MI",4,23,"So id like to know how much the cashier's at meijer are making, it can't be much because there are only 2 lines open EVER other than the self checkouts. The lines are RIDICULOUSLY LONG. People standing there for an hour meanwhile the frozen foods unthawing, forget getting ice cream because itll be bad before you leave. I used to love meijer but now 2-3x a week i DREAD going. I don't mind using the self checkout atall except every other item itll stop working so you have to call an employee over and wait..and wait and wait some more because everyone else's machines are down also. So why shop there? Because im not getting paid as a cashier or bagger, but if i don't go in self checkout and do everything myself, ill be in an hour 1/2 line with food that's gone bad  Mejjers makes enough money to pay an APPROPRIATE WAGE to there worker's/future workers so they can hire more help smh. Rant over",en,5/7/2023,1,N/A,N/A,N/A
meijer-rochester-hills-2,Amanda B.,grv8l0dcsGFuJPa0_cXkRg,https://www.yelp.com/user_details?userid=grv8l0dcsGFuJPa0_cXkRg,https://s3-media0.fl.yelpcdn.com/photo/KS9Z26KmYf-gS8CNWATt4w/60s.jpg,"Troy, MI",1754,596,"Don't get balloons at Meijer, a modern fairytale: *first off all of the balloons were tied onto one balloon string, instead of individual, the end result being a weird crown of balloons*at checkout the cashier literally untied one of the specialty balloons to scan it, then let it go. It was magical watching it float to the ceiling. ‍ *i had noticed that the woman who got my balloons for me had a cut on her hand, didn't notice until I got to my friends house that the woman helping me apparently bled on one of the balloons.  *all of the balloons were deflated the day after I got them",en,3/8/2022,1,N/A,N/A,N/A
meijer-rochester-hills-2,Wayne K.,zucuB8z9OoJJtOX4ROmKCQ,https://www.yelp.com/user_details?userid=zucuB8z9OoJJtOX4ROmKCQ,https://s3-media0.fl.yelpcdn.com/assets/srv0/yelp_styleguide/514f6997a318/assets/img/default_avatars/user_60_square.png,"Washington, DC",N/A,1,"It was not quite 8 pm on a Sunday night.  The store closes at Midnight.  Only one check-out open.  There were 11 self-checks with a line up.  Staff was snarky.  Come on Meijer corporate, you can do better than this.",en,7/23/2023,1,1,N/A,N/A
meijer-rochester-hills-2,Karen W.,OMWn1Kqsh_Yio8TuH4pMsg,https://www.yelp.com/user_details?userid=OMWn1Kqsh_Yio8TuH4pMsg,https://s3-media0.fl.yelpcdn.com/photo/QKV1Gs8LxYl_VfuFzQZJ5w/60s.jpg,"MI, MI",860,824,"This is the worst Meijer I've ever been to. The layout if very strange and not typical of Meijer. The Food is spread out all over the place. Took me 35 minutes to find eggs, which wear near the shoes and frozen. Ummmm ok, logical right.They have a very limited selection if home goods compared to other Meijer locations. I was unable to find several things I was looking for and had to go next door to Walmart. I will drive the extra 7 minutes for the Rochester Rd. Meijer in the future.",en,6/12/2021,2,3,N/A,1
meijer-rochester-hills-2,Russ R.,_gSaywoa3v7b3i2iN7EwFw,https://www.yelp.com/user_details?userid=_gSaywoa3v7b3i2iN7EwFw,https://s3-media0.fl.yelpcdn.com/photo/xGeWsrLMhftHcfDa6dT5zw/60s.jpg,"Royal Oak, MI",N/A,2,Clean store laid out well and hundred times better than. Walmart  And Meijers simply give program gets customers involved in helping others in need,en,12/28/2022,5,N/A,N/A,N/A
meijer-rochester-hills-2,Michael W.,hc89DC6xaXIcvFRF-TXu0Q,https://www.yelp.com/user_details?userid=hc89DC6xaXIcvFRF-TXu0Q,https://s3-media0.fl.yelpcdn.com/assets/srv0/yelp_styleguide/514f6997a318/assets/img/default_avatars/user_60_square.png,"Rochester Hills, MI",N/A,8,Everything was in stock that I was looking for and the store was clean. The cashier was friendly and efficient.,en,4/18/2023,5,N/A,N/A,N/A
meijer-rochester-hills-2,Cindy S.,Cwv8lhMLI13ysQUNLHtvdA,https://www.yelp.com/user_details?userid=Cwv8lhMLI13ysQUNLHtvdA,https://s3-media0.fl.yelpcdn.com/photo/T_w-W8gfumcuNsYHEq6DTQ/60s.jpg,"Troy, MI",1,7,"Went shopping at meijer (marketplace location)   so disappointed big time.  Store was a mess.  Shelves were basically empty.    I expected that to a point.   The big issue was how dirty the store was.  Sugar on the floor and all over the shelves.   Bread on the floor.  Moldy  produce, brown lettuce (all varieties)   and just pure grossness.  The fruit was horrible.  Brown grapes and bruised apples. Needless to say i did not purchase any fresh produce except a small bunch of broccoli.  It still cost me over $200 for the minimal groceries.   Will not return.",en,10/13/2022,1,N/A,N/A,N/A
meijer-rochester-hills-2,P M.,EvQkoCuvPB3JqqTlXIf4eg,https://www.yelp.com/user_details?userid=EvQkoCuvPB3JqqTlXIf4eg,https://s3-media0.fl.yelpcdn.com/assets/srv0/yelp_styleguide/514f6997a318/assets/img/default_avatars/user_60_square.png,"Warren, MI",N/A,1,Don't purchase gift cards at Meijer's.  We purchased a $100 Meijer gift card as a present only to discover later from the recipient that there were $0 on the card.  Meijer's management were less then helpful in trying to resolve the issue and basically said that once we left the store with the card there was nothing they could do.,en,2/18/2023,1,N/A,N/A,N/A
meijer-rochester-hills-2,Amy P.,p2d-dI88yKgzLU-IeslWcg,https://www.yelp.com/user_details?userid=p2d-dI88yKgzLU-IeslWcg,https://s3-media0.fl.yelpcdn.com/assets/srv0/yelp_styleguide/514f6997a318/assets/img/default_avatars/user_60_square.png,"Rochester, MI",1,4,"Only 4 cashiers working at any given time and lines to use self checkout can take 40 minutes- the lines daily go into the card section or clothing section. More employees are needed. Major stock issues since the pandemic as well despite Kroger and other neighboring Meijers have most items in stock pretty consistently. Also, we don't need greeters at the door to say hello.. would much prefer to have additional cashiers who can actually check out and keep the process of moving quickly",en,12/4/2022,1,N/A,N/A,N/A
meijer-waterford-township,Russ H.,6_GliouxI6YBOByAI-bzkw,https://www.yelp.com/user_details?userid=6_GliouxI6YBOByAI-bzkw,https://s3-media0.fl.yelpcdn.com/photo/-Ta_u8xvz31yCTQTeYwEIw/60s.jpg,"Royal Oak, MI",16,307,"Meijer's is a fixture in Michigan. It has never been the nicest looking store or had the best merchandise but that's not what they trade on. The are about convenience. I come here often for groceries. If there is something they do well, it's their groceries. Good selection, decent prices, and always open.The best I can do is list what they do well and what they don't.Do Well:1 - Hours: They are 24-hour. Can't do better than that.2 - Groceries: Good selections and well kept.3 - Registers: While in peak times, the lines can get long, they are usually good about keeping enough registers open.Do Not:1 - Staff can run from very helpful, to not terribly helpful. Not rude but uninformed sometimes.2 - Store can be disorganized. It is a huge place, so it would be very hard to keep it perfectly organized all the time, but sometime it seems as if they just don't put disorganized shelves back how they should go.3 - Not a place with high-end things. Always has had the feel of a place with mid to low end bargain merch. In the end, I go here often for bottle returns and groceries. If I need a press-board bookshelf, or cheap folding chairs, this is a place for that. Great for emergencies, especially at 2am. But will never be a Target.But it IS much better than Wal-Mart. I will always come to Meijer's before Wal-Mart",en,10/13/2020,3,2,3,2
meijer-waterford-township,Gary W.,vB1GBcBzxskRXPI6Ur2cdw,https://www.yelp.com/user_details?userid=vB1GBcBzxskRXPI6Ur2cdw,https://s3-media0.fl.yelpcdn.com/assets/srv0/yelp_styleguide/514f6997a318/assets/img/default_avatars/user_60_square.png,"Downtown Detroit, Detroit, MI",N/A,1,Turned me away an hour before they were supposed to close.Store hikes prices of milk around Christmas time in hopes people are too busy to notice the hike.,en,9/10/2023,1,N/A,N/A,N/A
