Place ID,User Name,User ID,User Link,User Thumbnail,User Address,User Photos Count,User Reviews Count,Review Text,Review Language,Review Date,Rating,Feedback Useful,Feedback Funny,Feedback Cool
meijer-clinton-township-2,Reilly A.,zin02eOt_2MYt_YBmK45ig,https://www.yelp.com/user_details?userid=zin02eOt_2MYt_YBmK45ig,https://s3-media0.fl.yelpcdn.com/assets/srv0/yelp_styleguide/514f6997a318/assets/img/default_avatars/user_60_square.png,"Harrison charter Township, MI",2,6,"Easily the worst grocery store I have ever been to. I only go when I cannot go anywhere else. There is constantly human feces in the men's restroom. I have reported it to the managers and every time nothing is done. When I reported it today I was told ""I called that in earlier"" which implies that it has been sitting for multiple hours. The store is messy and is never stocked with items. If the bathroom is this bad, imagine the deli and places where food is being prepared.",en,11/5/2021,1,1,N/A,1
meijer-clinton-township-2,Mark C.,48DVJboDmac3PBDxGy6itA,https://www.yelp.com/user_details?userid=48DVJboDmac3PBDxGy6itA,https://s3-media0.fl.yelpcdn.com/photo/zqdC08Tbbb9xmzuTHJbpDg/60s.jpg,"Fraser, MI",11377,550,"Just came in for three items. They had what I wanted so that was cool. Checking out was an issue, went to the self checkout one of the scanners were out of order and the five people who were using the other ones did not get the concept of in and out fast. One guy was smacking it because he didn't know how to start it. A women couldn't feed in her coupons. Two others had more than 12 items. The other person couldn't figure out how to pay with cash. The two workers were trying to assist the smacking guy. So I got my three items quick and my check out not so much.",en,3/21/2018,3,2,3,2
meijer-clinton-township-2,Karen N.,ino6td-fF9Ka1lRPfnvQxw,https://www.yelp.com/user_details?userid=ino6td-fF9Ka1lRPfnvQxw,https://s3-media0.fl.yelpcdn.com/photo/Ysu_wKBfKRWA45SlcA4Wag/60s.jpg,"Macomb Township, MI",27361,452,"As always a great experience at the store location. Fresh produce, stocked shelves, happy employees, clean floors, clean meat areas, and Dairy stacked coolers for milk and no smells. Bottle return clean all working. Upbeat music.  I passed by three employees in between my shopping saying hello and asking if I needed help, that's a great way to shop. I found all my items I needed off my list plus a couple items I did not I plan on buying but did.This Meijer is worth the drive. Also the parking lot was clear of baskets all baskets inside clean, in line ready to go for customers. A greeter inside the door had a basket ready for me, so a great way to start for sure since they're doing their job saying hello and having a basket ready to use. If you shop at Meijer on Hall Road make the drive and try this one. Don't bother with the Meijer at 23 and Gratiot it's so run-down it needs to be remodeled sorry for the negative comment or opinion",en,11/15/2017,5,4,N/A,3
meijer-clinton-township-2,Sandi M.,k1NC6TAMjOpt1XuYGuwJ_A,https://www.yelp.com/user_details?userid=k1NC6TAMjOpt1XuYGuwJ_A,https://s3-media0.fl.yelpcdn.com/photo/4HDfUrm-7d-kEx14XgqeUw/60s.jpg,"Harrison charter Township, MI",508,271,Bottle return.  Pickup day Lilly's.  4 can machines were out of order.  Used the red phone to call for service and someone arrive 10 min later.  The good news the day lily s were on sale for 2.50,en,7/16/2019,3,8,4,8
meijer-clinton-township-2,Raymond H.,vtf1Wf-lAUrEeH1rql7HMg,https://www.yelp.com/user_details?userid=vtf1Wf-lAUrEeH1rql7HMg,https://s3-media0.fl.yelpcdn.com/photo/OgZRRYJ6945Nt2fM4ryvaw/60s.jpg,"Daytona Beach, FL",1,3,"Sunday afternoon, 4 cashiers? Can't say I will shop there for the next six months-their are way to many option for me to spend my time waiting in line",en,3/1/2020,1,N/A,N/A,N/A
meijer-clinton-township-2,D W Z.,C8TFh1ZOgFu8AMN7h4GyBA,https://www.yelp.com/user_details?userid=C8TFh1ZOgFu8AMN7h4GyBA,https://s3-media0.fl.yelpcdn.com/assets/srv0/yelp_styleguide/514f6997a318/assets/img/default_avatars/user_60_square.png,"Charter Township of Clinton, MI",N/A,33,"Never have what they have advertised. Got there at 6 AM the 1st hour of the weekly sale. Vitamin E for sale 2 for 1. None on the shelf. Checked another brand. Same thing. Plenty of the Meijer brand at full price. Went to Kroger. Got what I need with plenty of stock at BOGO.Riced cauliflower advertised on sale. About 4 or 5 different brands. No sale tags posted. Couldn't remember which brand was on sale. Went without.Let's stock the store. Mark those items that are on sale. OR, just go to Kroger.",en,2/21/2021,1,N/A,N/A,N/A
meijer-fremont-2,Zoe P.,iJiUTlwvjYP3bOKMKOFrAA,https://www.yelp.com/user_details?userid=iJiUTlwvjYP3bOKMKOFrAA,https://s3-media0.fl.yelpcdn.com/assets/srv0/yelp_styleguide/514f6997a318/assets/img/default_avatars/user_60_square.png,"SoMa, San Francisco, CA",1,6,"My friends and I just love Meijer. We love it so much. It always had what we need, and this Meijer is no exception. Thank you for the eye masks and tequila. xoxo, four fun-loving recently vaccinated (three Pfizer, one Moderna) recent grads of the University of Michigan, Ann Arbor.",en,5/18/2021,5,N/A,N/A,N/A
meijer-fremont-2,David T.,apFbpKObFhxGKfpM32mFiA,https://www.yelp.com/user_details?userid=apFbpKObFhxGKfpM32mFiA,https://s3-media0.fl.yelpcdn.com/photo/OxZJvEEDXl_jnG0KCWvzcQ/60s.jpg,"Cleveland, OH",136,50,"A huge and super clean store. It was well organized and well-stocked store. They had a great selection of fresh fruits and vegetables. If you live near Fremont, this is a great store to visit for food and a bunch of other stuff too.",en,7/27/2023,5,N/A,N/A,N/A
meijer-fremont-2,Mat E.,C3X9wAX2MaY-PgPcdqJKow,https://www.yelp.com/user_details?userid=C3X9wAX2MaY-PgPcdqJKow,https://s3-media0.fl.yelpcdn.com/assets/srv0/yelp_styleguide/514f6997a318/assets/img/default_avatars/user_60_square.png,"SoMa, San Francisco, CA",N/A,2,"Sign on the door ""all individuals are encouraged to wear a face mask"" yet I did not see one employee wearing one. Was told they're not required to.I wondered (as I drove to Walmart to get my items) if they're at least encouraged to.",en,8/16/2021,1,N/A,N/A,N/A
meijer-fremont-2,Erica L.,gOrsrk8ogpHUEr9wfBfjuQ,https://www.yelp.com/user_details?userid=gOrsrk8ogpHUEr9wfBfjuQ,https://s3-media0.fl.yelpcdn.com/photo/i9-2nC42E9Z0QFIFMCErxA/60s.jpg,"Grant, MI",15,60,"This is my absolute favorite Meijer store. It is always so clean, the people are so friendly and the shelves are always stocked (even during a pandemic!!). I am very lucky that this Meijer is the closest one to my home. Love Fremont.",en,5/28/2020,5,1,N/A,N/A
meijer-fremont-2,Jennifer C.,jPrBzW4zuDd-F13X2iRDlA,https://www.yelp.com/user_details?userid=jPrBzW4zuDd-F13X2iRDlA,https://s3-media0.fl.yelpcdn.com/assets/srv0/yelp_styleguide/514f6997a318/assets/img/default_avatars/user_60_square.png,"SoMa, San Francisco, CA",N/A,1,So I would have given this review 5 stars if not for the deli. The customer service is great the people there are so nice. Usually whenever I have a problem in the store someone from the floor will help me out no problem. I even had a lady with an apron on help me on her way out the door one day. But my problem with the deli department is how the employees are treated. I have a friend that works there and I have heard some things about how they are. Apparently the team leaders will leave for an hour or more when all they're doing Is garbage then how toxic the work environment is takes a toll on them. There has apparently been threats made to another employee that their job was on the line when they didn't really do anything wrong. I've heard mention of more things too that the head person in the deli did on some inspection day and it was awful. I can only imagine what more happens behind the scenes that they haven't said. I hope the company sees the problem and tries to fix it.,en,5/29/2021,4,N/A,N/A,N/A
meijer-gaylord-2,Olivia W.,jwYCyGwHkBM3EqSRSV1pVw,https://www.yelp.com/user_details?userid=jwYCyGwHkBM3EqSRSV1pVw,https://s3-media0.fl.yelpcdn.com/photo/Khk7WJzhs9xCDm4yynOpmg/60s.jpg,"San Francisco, CA",N/A,4,I love how it's close to a lot of neighborhoods and I love the for 10 for 10 sale. Target doesn't have that. I also like how they remodeled it and that it's very big. Everybody's nice there and friendly,en,11/26/2020,5,N/A,N/A,N/A
meijer-gaylord-2,Marie B.,MlXwLd4oF1AJU4wPTsesIw,https://www.yelp.com/user_details?userid=MlXwLd4oF1AJU4wPTsesIw,https://s3-media0.fl.yelpcdn.com/photo/ZKCFkB5fFiVIfbhazNYV7w/60s.jpg,"Canton, MI",653,444,"Oh my gosh.  I usually live to shop at a Meijer even in this pandemic.  This store is terrible.  First the layout sucks. Frozen food by home goods, cheese by baby department.  What fool designed this?  It must have been so you shop other departments but I don't look for stuff when I'm with cold food produces.  Also I went to pay my charge at the service desk and it took about 15 -20 minutes and I was the only one there.  Their machine would not take my credit card after it did the machine frozen so we had to go to the other register and start again.  Checkout was extremely busy.  They had one whole self checkout section closed. And no one was wiping down the screen after previous customers. EXTREMELY TERRIBLE STORE",en,10/25/2020,1,3,N/A,N/A
meijer-gaylord-2,Bob A.,SDrva0-KjmQ5MLWNV1CqMA,https://www.yelp.com/user_details?userid=SDrva0-KjmQ5MLWNV1CqMA,https://s3-media0.fl.yelpcdn.com/photo/RIhA4WiK3-2AI2V_Oh-KEw/60s.jpg,"Sault Ste. Marie, MI",2986,321,"Not the best Meijer I've been in, but it is our last gas stop before the UP. Ten cent per gallon discount if you use MPerks and the Meijer credit card. Trey also are one of the few places I've always been able to get Charleston Chews every time.  It's usually busy at the pumps. Bathrooms appear to get a lot of use. There's some grassy areas near by to let the dog take a break while you fill your tank. A little farther off the freeway, but worth the trip.",en,6/7/2020,3,3,1,1
meijer-gaylord-2,Tracy A.,-FxsSuwDbIII7yo5BjHpiA,https://www.yelp.com/user_details?userid=-FxsSuwDbIII7yo5BjHpiA,https://s3-media0.fl.yelpcdn.com/photo/ZaQQVs49dKVQ_7OrA3kwXw/60s.jpg,"Kirkland, WA",6317,922,"I actually added this business to Yelp do that I could write a review about how great our cashier, Bethany, was. She was not only very pleasant, but she actually bagged our groceries the way we had staged them on the belt. The store itself was bright, well stocked, and in an up to date layout. Also an employee from the meat department saw the bewildered look on my face and stopped to direct me to the ham. Best experience I've had at a  Meijer in ever!",en,8/25/2017,5,1,N/A,1
meijer-gaylord-2,Christina S.,rd2LW3jDXsypkBvGkcnToA,https://www.yelp.com/user_details?userid=rd2LW3jDXsypkBvGkcnToA,https://s3-media0.fl.yelpcdn.com/photo/iiAWwb-zrKKV2zfkxeHajg/60s.jpg,"Spring Lake, MI",98,77,"It's Thanksgiving and you'd think the staff would be upset they had to work. Everyone was so helpful this morning! We were searching for a special toy and Dennis in the pet department called to help. Immediately two girls were there to help. Each of them wishes us a Happy Thanksgiving. I asked if they were bummed they had to work. Each of them had a positive response. Most said, ""at least I don't have to cook."" Or they had family plans later. Everyone was so nice. Thanks for making our special Thanksgiving trip to Gaylord from Grayling a great way to start our day.",en,11/28/2019,5,2,N/A,N/A
meijer-grand-haven,Kate B.,VrSfRef2iuxodyaa6e5yBg,https://www.yelp.com/user_details?userid=VrSfRef2iuxodyaa6e5yBg,https://s3-media0.fl.yelpcdn.com/photo/-_ZpyevZ7-13EvBu-fDSYg/60s.jpg,"Playa del Rey, Playa del Rey, CA",4,19,"Hopefully someone from the Meijer supervisor team sees this, as I discovered there is no user-friendly way to leave positive feedback on Meijer.com- just wanted to say we've had two really standout experiences at this location in the last week and it's extremely refreshing. The young man working the self-checkout on the pharmacy side around 5:00pm (he was wearing a Thanksgiving themed headband) had the loveliest energy and attitude I've encountered in customer service in a really long time. Seriously, a ray of sunshine. He's a credit to your staff and I hope y'all take excellent care of him. Could tell that he loves what he does and he made a point to make our day brighter. That's saying something for working a busy day before the holiday! He could've just as easily been stressed or not taken the time to chat at the register, but he did and it actually made my day much better. Thank you! I'm sorry we didn't catch your name. Also, the gentleman who was bringing out pickup orders on Black Friday around 4:00 was so quick, friendly and cheerful- much the same as above. We had a huge order and he managed it with a smile and ease. Thank you! Great job guys.",en,11/25/2023,5,1,N/A,N/A
meijer-grand-haven,Harry R.,1wdtXmOv7SAK6wjBlNvXQg,https://www.yelp.com/user_details?userid=1wdtXmOv7SAK6wjBlNvXQg,https://s3-media0.fl.yelpcdn.com/photo/gOKKyxPDVitarxjcpUUPLw/60s.jpg,"Gold Coast, Chicago, IL",126,101,"This is a good location, but it could be better....a lot better.Some of the pros: -Great deli service.-Fresh deli salads.    -A lot of the other locations have switched to prepackaged salads, like          Walmart, not this one, at least not yet.-Good meat dept.   Very friendly and accommodating, if you need       something sliced.-Self checkout moves rather quickly.Cons:-Out of many items.-Prices are now more expensive than Walmart on all but sale items.-Too many sale items require quantity purchase to get the sale price.",en,1/5/2024,3,1,N/A,N/A
meijer-grand-haven,Charlsie D.,JdFpB2g9Jpt7q50-zvoHXA,https://www.yelp.com/user_details?userid=JdFpB2g9Jpt7q50-zvoHXA,https://s3-media0.fl.yelpcdn.com/photo/Ev1QGDWjEJQ9_zPSo0YLnw/60s.jpg,"Austin, TX",249,161,"Thank you to the Manager, Tyler, for calling and making sure my feedback was taken into consideration.",en,7/28/2023,4,N/A,N/A,N/A
meijer-grand-haven,Jeannette R.,aJSX0mI5MFer8_BbiFGgMg,https://www.yelp.com/user_details?userid=aJSX0mI5MFer8_BbiFGgMg,https://s3-media0.fl.yelpcdn.com/assets/srv0/yelp_styleguide/514f6997a318/assets/img/default_avatars/user_60_square.png,"Grand Rapids, MI",N/A,1,Went to meijer in Grand Haven to shop for groceries.  While I was there I tried to return some shoes where the ilet for the shoelace had broken within a few days of buying them. The lady at customer services would not let me return them because I bought them at the Holland Meijer and told me I must return them to the store I bought them at. Unfortunately I di not have the time to drive all the way to Hollend to return them today but will now have to make a special trip to do this. When did this happen. Really walmart does not have this rule. Pretty sad. I have been a regular customer of Meijer for many years and am pretty disappointed in the customer service today. I never write reviews but could not let this one go without saying somthing.,en,9/10/2023,1,1,N/A,N/A
meijer-grand-haven,Darlene A.,A6cQspZpSDkLQhqLja0ioQ,https://www.yelp.com/user_details?userid=A6cQspZpSDkLQhqLja0ioQ,https://s3-media0.fl.yelpcdn.com/assets/srv0/yelp_styleguide/514f6997a318/assets/img/default_avatars/user_60_square.png,"Grand Haven, MI",1,5,"Always fantastic service from the team members, especially Jim Gust team in the order pick up department.  Is there is always clean, easy to navigate, has so many different product options and yet manage to keep the price as low as possible.  Not to mention some of the best produce in town.",en,9/15/2023,5,N/A,N/A,N/A
meijer-grand-haven,Kelly B.,Zta_1wQX25lCejDr6ZlVqA,https://www.yelp.com/user_details?userid=Zta_1wQX25lCejDr6ZlVqA,https://s3-media0.fl.yelpcdn.com/photo/_YMrlmcEpD1Emo_NdaBPcg/60s.jpg,"Berkley, MI",146,185,Seemed to be recently renovated and fairly nice inside. But went with the goal of finding a mens bathing suit and despite it being a beach town in August there were barely any bathing suits in the whole store... so maybe skip it if that's what you're looking for,en,8/22/2022,4,1,N/A,N/A
meijer-grand-haven,H R.,0id3Rd2-qSouFXqqKcTraA,https://www.yelp.com/user_details?userid=0id3Rd2-qSouFXqqKcTraA,https://s3-media0.fl.yelpcdn.com/photo/5hXhCrJNGZua0Jzg8_FWYQ/60s.jpg,"MI, MI",95,98,"Now they've  moved the can return machines even further in the store.You literally go from one end of the store to the other to return the cans/bottles.     They have been out of service from time to time lately.If you go on Sundays, this place is a madhouse.    Getting a small cart is a rarity as they are snatched up so quickly.   The guys out in the parking lot whose main job is to retrieve carts are more interested in talking with each other while smoking a cig.If an item is on sale that week, chance are the shelf where it displayed has already been cleaned out by earlier shoppers.   Sure, you could go around to the red phone and call someone to restock the shelf, but why does a customer has to remind the employee to do his/her job?While the sale prices are pretty low....the day to day items can be found for less across the street at Wal-mart.",en,5/9/2021,2,1,N/A,N/A
meijer-grand-haven,Harold W.,hd2tLGf2plfUWRa7kUsPxQ,https://www.yelp.com/user_details?userid=hd2tLGf2plfUWRa7kUsPxQ,https://s3-media0.fl.yelpcdn.com/photo/zdZaqlVavm-LUP_okHuF2g/60s.jpg,"Ann Arbor, MI",N/A,2,"I always have loved Meijer stores. Great prices, great people and owned by a great family.  But who the heck decided to reorganize this store in 2019?!   It's confusing and senseless.  Probably the brain child of some designer the thinks everyone shopping there beelines for the kombucha and organic kale.  Not most of us. If its not broken, don't fix it!",en,4/8/2019,2,2,N/A,N/A
meijer-grand-haven,Elisha T.,eSKEpwZRyRuQ56AYVWnLeA,https://www.yelp.com/user_details?userid=eSKEpwZRyRuQ56AYVWnLeA,https://s3-media0.fl.yelpcdn.com/photo/DEzxWrMIpB_9eTipO8nBQw/60s.jpg,"Scottsdale, AZ",136,261,Great selection of produce but rude and grumpy employees. This seems to be the theme at every place in Grand Haven. Grumpy and miserable employees who act like you are inconveniencing them just by being there.,en,11/10/2018,2,1,N/A,N/A
meijer-grand-haven,Chris N.,8MUg0WfO1JFXzccpe19V3Q,https://www.yelp.com/user_details?userid=8MUg0WfO1JFXzccpe19V3Q,https://s3-media0.fl.yelpcdn.com/photo/vp2crFcJ4u4gXx5qpM3FoA/60s.jpg,"Kalamazoo, MI",725,99,"Terrible, rude, unhelpful employees across the store. Couldn't be bothered to even answer one simple question about where to find an item. Train them better!",en,9/27/2019,1,N/A,N/A,N/A
meijer-grand-rapids-4,Jason G.,SkdA31YuuhVmJtesLiZLVA,https://www.yelp.com/user_details?userid=SkdA31YuuhVmJtesLiZLVA,https://s3-media0.fl.yelpcdn.com/photo/kiX-kgpZSB_vF-lmHSq6Fw/60s.jpg,"Fort Gratiot Township, MI",126,437,This is a review written by a history buff.  So just go with it.  This is the original site of meijer.  Now the current building looks suspiciously like a thousand other meijer.  But In my view that's worth a least four stars alone.  Everyone in the Midwest knows this is to be preferred over wal-mart any day.   This one has everything you could need and is where it all started!,en,8/19/2023,5,N/A,N/A,N/A
meijer-grand-rapids-4,Kevin J.,HGrZ9iirx3rlvUQgYO3fIg,https://www.yelp.com/user_details?userid=HGrZ9iirx3rlvUQgYO3fIg,https://s3-media0.fl.yelpcdn.com/assets/srv0/yelp_styleguide/514f6997a318/assets/img/default_avatars/user_60_square.png,"Bailey's Grove, Kentwood, MI",N/A,1,"The flagship 28th St. Cascade store has gone S !Went there on Sat. night(6p.m.) , and they were out of about 50% of the items I wanted.If you want selection in the evenings , go to D&W You should change name of stores to ""Meijer-All Out""",en,1/8/2023,2,N/A,N/A,N/A
meijer-grand-rapids-4,Alan T.,4qbFlv4ys4vDnCt6Nj0H6A,https://www.yelp.com/user_details?userid=4qbFlv4ys4vDnCt6Nj0H6A,https://s3-media0.fl.yelpcdn.com/assets/srv0/yelp_styleguide/514f6997a318/assets/img/default_avatars/user_60_square.png,"Kentwood, MI",N/A,22,Saturday morning 9:20 am. Not one GD service checkout open! Self serve was backed up with 15-20 people still waiting! Walked out and left a cart full of groceries! Very way to run a business! Plenty of other places to shop!,en,7/23/2022,1,N/A,1,N/A
meijer-grand-rapids-4,Gladys C.,d2rJoyznlcf6Rdi9wzc5kg,https://www.yelp.com/user_details?userid=d2rJoyznlcf6Rdi9wzc5kg,https://s3-media0.fl.yelpcdn.com/assets/srv0/yelp_styleguide/514f6997a318/assets/img/default_avatars/user_60_square.png,"SoMa, San Francisco, CA",N/A,1,"The store is dirty, their self check kiosks are terrible but they will have one lane open for check out.  They eliminated the gluten free allergy friendly section and selection.  Pricing has gone up with quality down.  Last time shopping there today-there is absolutely nothing that makes them stand out from other choices any more. In fact they are about the worst as far as cleanliness, service, and selection.",en,7/24/2022,1,N/A,N/A,N/A
meijer-grand-rapids-4,Donna D.,aguA5ogu-SAWGlOq3WNTqA,https://www.yelp.com/user_details?userid=aguA5ogu-SAWGlOq3WNTqA,https://s3-media0.fl.yelpcdn.com/assets/srv0/yelp_styleguide/514f6997a318/assets/img/default_avatars/user_60_square.png,"Grand Rapids, MI",N/A,5,"What is so difficult about writing out a rain check on an Meat item you advertise?  It's not like they won't be coming in, in a day or two.  The meat counter guy tells me the cashier will write me one.  Get thru that line and informs me the customer service has to write it out......after 30 min waiting in that line for there's only one person working.....informs me they can't write me one because of ""the systems being slow"", and that you don't do those anymore.....can't blame this on the pandemic, or staff, or anything else.  Fix your policies.  Meijer's is not what it once was.....sad!!!",en,3/12/2022,2,N/A,N/A,N/A
meijer-grand-rapids-4,Tab B.,TRdH2UkcIhqx8zcsoGAN3Q,https://www.yelp.com/user_details?userid=TRdH2UkcIhqx8zcsoGAN3Q,https://s3-media0.fl.yelpcdn.com/photo/aQZ8P_O_WJFQYHWDXtZLMA/60s.jpg,"Grand Rapids, MI",29,293,"Same feedback. Terrible layout. Not much probably can be done with the department layout but please do something about the restroom situation. You really need to have centralized common restroom at the front instead of single toilets scattered around the store. The last thing a customer wants to do is go all over the place hunting for these toilets. Even the employees feel the same way. Yes, I talked to some of them.I don't think Meijer has heard of the old saying - if it ain't broke don't fix it!",en,4/4/2017,2,1,3,N/A
meijer-grand-rapids-4,Pete G.,rZQi5aY-fRk0SVpv4PbzOg,https://www.yelp.com/user_details?userid=rZQi5aY-fRk0SVpv4PbzOg,https://s3-media0.fl.yelpcdn.com/photo/1xylbeFaWMRi8fbieI8-9A/60s.jpg,"Castle Rock, CO",1383,323,"Not my favorite of the Meijer locations, but when in Rome (or in this case Michigan)...  Like most Meijer there are acres of shopping, but it's the layout that's the real problem here.  A very disjointed experience, so the flow of the store isn't overly conducive to browsing.  This is probably a good thing as Meijer likes to offer lots of shopping possibilities, so best to go with a list and stick to it.  The parking isn't ideal either but that may have to do with location alone.  Real estate aside, you can always count on decent customer service at Meijer.  I've had no problem finding friendly help when needed and people willing to go above and beyond to ensure I've found what I was looking for.",en,12/23/2017,3,2,2,1
meijer-grand-rapids-4,Lacey J.,Iso3eec0ah40gtCmBi06Uw,https://www.yelp.com/user_details?userid=Iso3eec0ah40gtCmBi06Uw,https://s3-media0.fl.yelpcdn.com/photo/jrxWNIgJmCsrN8r4YMIsBQ/60s.jpg,"Grand Rapids, MI",15,42,"Tonight, about 915, I came in through the self checkout by produce where a customer did something to the young lady running self checkout. She has glasses, blonde hair, about 5'7. Anyways, he made her cry and as the line grew and all the self-checkouts were blinking red and others needed her assistance, she called for help and collected herself, and continued to help everyone. She's an amazing team member that should be recognized for continuing to help guests while crying because someone got angry at her.",en,4/28/2019,5,4,N/A,3
meijer-grand-rapids-4,Matt P.,Y7PjXL7GBHaP37Im9Zk4ew,https://www.yelp.com/user_details?userid=Y7PjXL7GBHaP37Im9Zk4ew,https://s3-media0.fl.yelpcdn.com/photo/TNEwJdm64xD4l6c5qBtQTA/60s.jpg,"Grand Rapids, MI",N/A,18,"Rude, oblivious, lazyThat describes most of ""those"" Meijer employees here.New store, but you can't keep the riff-raff out.  Littered parking lot, dirty floors, filthy bottle return room""People"" out front asking for money, cigarettes, etc.  (usual recycled stories they use -- even at the Meijer gas station across the street)Employees at self-serve lanes ignore flashing red lights -- you have to go up to the employee station or wave your hand.  At their stations, I've witnessed them eating Girl Scout cookies and other foods.Service desk is ridiculous -- one lazy employee eating pork rinds after doing a Western Union transaction while a line of patrons wait.Oh, they also enjoy texting, that important text takes priority over serving the customer.It's the closest Meijer to me, unfortunately.  I shop late night / early morning and it's still bad.",en,11/19/2016,2,4,3,N/A
